### ISSUE TITLE
Android Node Pairing: "gateway error: not initialized" - Missing node service

### ISSUE THREAD

**Issue by shortbus** [openclaw/openclaw#13143]
# Android Node Pairing: "gateway error: not initialized"

## Environment
- **Gateway OS**: macOS 15.2 (Darwin 26.2.0, arm64)
- **Gateway Version**: OpenClaw 2026.2.9 (33c75cb)
- **Android Device**: Motorola Moto G (2025)
- **Android App**: OpenClaw APK built from source (2026.2.9)
- **Network**: Local LAN (gateway 192.168.1.100, Android 192.168.1.50) + Tailscale
- **Instance ID**: `705af6ac-9c80-407a-b6df-8aa0ce88ca37`

## Problem
Android OpenClaw app shows **"gateway error: not initialized"** when attempting to pair with the gateway, despite successful WebSocket connections.

## Symptoms
1. Android app connects to gateway WebSocket endpoint
2. WebSocket upgrade succeeds (verified via tcpdump)
3. Connection closes immediately (20-40ms, code=1000, reason=bye)
4. Android device never appears in `openclaw nodes status`
5. No pairing request reaches pending approval queue
6. Gateway logs show no device handshake messages

### 1. Network Connectivity ✅
- Gateway initially bound to loopback (connection refused from remote)
- **Fixed**: Changed `gateway.mode: "local"` → `"network"` with `host: "0.0.0.0"`
- Gateway now listening on `*:18789` (all interfaces)
- tcpdump confirmed TCP connections from Android device successful

### 2. Device-Pair Plugin Configuration ✅
- **Fixed**: Updated `plugins.device-pair.config.publicUrl` from `https://...` to `http://gateway-host.tailnet:18789`
- Control UI accessible via SSH tunnel (requires HTTPS or localhost)

### 3. Pairing Approval via Control UI ❌
- Approved device in Control UI, but device registered with wrong metadata:
  - `clientId`: "openclaw-control-ui" (should be Android app identifier)
  - `clientMode`: "webchat" (should be "node")
  - `platform`: "MacIntel" (should be "android")
- Indicates Android app not sending proper pairing handshake before disconnect

### 4. Manual Pairing Entry ❌
- Created device entry in `~/.openclaw/devices/paired.json` with:
  - Device ID: SHA256 hash of instance ID
  - Platform: "android"
  - Client Mode: "node"
  - Display Name: "motorola moto g - 2025"
- Android app still showed "gateway error: not initialized"

### 5. Root Cause Discovery ✅
Running `openclaw status` revealed:
```
│ Node service    │ LaunchAgent not installed                                                                         │
```

**The node service was not installed/running on the gateway host.**

## Solution
Installed the node service:
```bash
openclaw node install
openclaw node status
```

Output:
```
Service: LaunchAgent (loaded)
Command: /opt/homebrew/bin/node /opt/homebrew/lib/node_modules/openclaw/dist/index.js node run --host 127.0.0.1 --port 18789
Service file: ~/Library/LaunchAgents/ai.openclaw.node.plist
Runtime: running (pid 14297, state active)
```

After installation, `openclaw nodes status` showed the gateway host itself as a node:
```json
{
  "nodeId": "a73100c1021b4bb93810f1df3299115238fad740c638d88b90fe13d3457ebb0c",
  "displayName": "Gateway Mac mini",
  "platform": "darwin",
  "version": "2026.2.9",
  "connected": true
}
```

## Questions / Outstanding Issues

1. **Does Android pairing work after node service installation?** (Not yet confirmed)
2. **Why doesn't `openclaw configure` prompt to install node service?** The wizard completed successfully but left the node service uninstalled, causing pairing to fail silently.
3. **Why do Android connections close before sending pairing handshake?** tcpdump shows 11-byte WebSocket frames, but no device handshake reaches the gateway logs.
4. **Should gateway binding require explicit `host: "0.0.0.0"`?** `mode: "network"` still defaulted to loopback initially.

## Relevant Config

<details>
<summary>Gateway Config (excerpts)</summary>

```json
{
  "gateway": {
    "port": 18789,
    "mode": "local",
    "bind": "lan",
    "auth": {
      "mode": "token"
    },
    "tailscale": {
      "mode": "off",
      "resetOnExit": false
    }
  },
  "plugins": {
    "entries": {
      "device-pair": {
        "enabled": true,
        "config": {
          "publicUrl": "http://gateway-host.tailnet:18789"
        }
      }
    }
  }
}
```
</details>

<details>
<summary>tcpdump Output (Android Connection)</summary>

```
22:10:17.461721 IP 192.168.1.50.50637 > 192.168.1.100.18789: Flags [P.], seq 0:250, ack 1, win 2059, length 250
GET / HTTP/1.1
Upgrade: websocket
Connection: Upgrade
Sec-WebSocket-Key: 7xSO2JUYnj/QCAfuyYysLg==
Sec-WebSocket-Version: 13
Sec-WebSocket-Extensions: permessage-deflate
Host: 192.168.1.100:18789
Accept-Encoding: gzip
User-Agent: okhttp/5.3.2

22:10:17.488688 IP 192.168.1.50.50637 > 192.168.1.100.18789: Flags [P.], seq 250:261, ack 254, win 2056, length 11
[WebSocket frame data - 11 bytes]

22:10:17.496781 IP 192.168.1.50.50637 > 192.168.1.100.18789: Flags [F.], seq 261, ack 262, win 2056
[Connection closes]
```
</details>

## Suggestions for Improvement

1. **Add node service check to `openclaw configure`** - Prompt/auto-install if user selects pairing features
2. **Better error messaging** - "gateway error: not initialized" is vague; could suggest checking `openclaw node status`
3. **Pairing diagnostics** - Add `openclaw pair --check` or similar to validate gateway/node service readiness
4. **Documentation** - Clarify that node service is required for device pairing (not just gateway service)

## Related Files
- `~/.openclaw/devices/paired.json` - Device pairing registry
- `~/.openclaw/devices/pending.json` - Pending approval queue (empty throughout)
- `~/Library/LaunchAgents/ai.openclaw.node.plist` - Node service definition
- `~/.openclaw/logs/node.log` - Node service logs
